{
  "id": "di_distractor_health",
  "name": "Add GET /health/detail under noisy, irrelevant memory",
  "suite": "capability",
  "family": "distractor",
  "difficulty": "easy",
  "tags": ["distractor", "robustness"],
  "prompt": "Add a GET /health/detail endpoint that returns a JSON object with keys: status (the string \"ok\"), tasks (the number of tasks currently stored), and users (the number of users). Keep existing behavior and tests passing.",
  "seed_scenario": "evals/scenarios/python_webapp_seed",
  "overlays": [],
  "grader_overlays": ["evals/grader_overlays/di_distractor_health"],
  "memory_seed": [
    {
      "type": "convention",
      "title": "HTTP error envelope",
      "summary": "All HTTP error responses use {\"error\": {\"code\", \"message\"}} via app/errors.py:error_response(); never raise bare HTTPException for client errors.",
      "confidence": 1.0,
      "status": "confirmed"
    },
    {
      "type": "decision",
      "title": "Compliance audit trail",
      "summary": "Every task mutation appends to db.EVENT_LOG via log_event(actor_id, action, task_id) for compliance.",
      "confidence": 1.0,
      "status": "confirmed"
    },
    {
      "type": "convention",
      "title": "Reuse the pagination helper",
      "summary": "List endpoints must reuse app/pagination.py:paginate(items, limit=, offset=) instead of re-implementing slicing.",
      "confidence": 0.95,
      "status": "confirmed"
    },
    {
      "type": "convention",
      "title": "List response envelope",
      "summary": "List endpoints return {\"items\": [...], \"count\": <int>}, never a bare array.",
      "confidence": 0.9,
      "status": "confirmed"
    },
    {
      "type": "fact",
      "title": "Roles",
      "summary": "Users have roles admin, member, viewer; only admin may perform destructive operations.",
      "confidence": 0.9,
      "status": "confirmed"
    },
    {
      "type": "concern",
      "title": "Status lifecycle",
      "summary": "Task status must follow todo -> in_progress -> done; reversing or skipping is invalid and returns 409.",
      "confidence": 0.85,
      "status": "confirmed"
    }
  ],
  "requirements": [
    {
      "id": "detail_shape",
      "description": "Returns status/tasks/users with correct counts",
      "command": "python -m pytest -q tests/test_di_distractor_health.py::test_health_detail_shape"
    }
  ],
  "timeout_seconds": 420,
  "max_budget_usd": 1.0,
  "graders": {
    "outcome": ["python -m pytest -q tests/test_di_distractor_health.py"],
    "regression": ["python -m pytest -q tests/test_health.py tests/test_tasks_baseline.py"],
    "static": ["ruff check app tests", "mypy app"]
  }
}
