{
  "id": "ef_reuse_pagination",
  "name": "Paginate GET /tasks by reusing the shared helper",
  "suite": "capability",
  "family": "memory_efficiency",
  "difficulty": "easy",
  "tags": ["pagination", "reuse", "efficiency"],
  "prompt": "Add optional `limit` and `offset` query parameters to GET /tasks so clients can paginate. Default to limit=50, offset=0, and return all tasks (after any existing ordering) within that window. Keep existing behavior and tests passing.",
  "seed_scenario": "evals/scenarios/python_webapp_seed",
  "overlays": ["evals/overlays/ef_reuse_pagination"],
  "grader_overlays": ["evals/grader_overlays/ef_reuse_pagination"],
  "memory_seed": [
    {
      "type": "convention",
      "title": "Reuse the pagination helper",
      "summary": "A shared, tested pagination helper already exists at app/pagination.py: paginate(items, limit=, offset=). ALWAYS reuse it for list endpoints instead of re-implementing slicing or bounds-checking; it already clamps negative inputs.",
      "confidence": 1.0,
      "status": "confirmed"
    },
    {
      "type": "fact",
      "title": "List ordering",
      "summary": "db.list_tasks() already returns tasks sorted by id ascending; preserve that ordering when paginating.",
      "confidence": 0.9,
      "status": "confirmed"
    }
  ],
  "requirements": [
    {
      "id": "limit_applies",
      "description": "limit bounds the number of returned tasks",
      "command": "python -m pytest -q tests/test_ef_reuse_pagination.py::test_limit_bounds_results"
    },
    {
      "id": "offset_applies",
      "description": "offset skips the first N tasks",
      "command": "python -m pytest -q tests/test_ef_reuse_pagination.py::test_offset_skips"
    },
    {
      "id": "defaults_all",
      "description": "Defaults return all tasks",
      "command": "python -m pytest -q tests/test_ef_reuse_pagination.py::test_defaults_return_all"
    },
    {
      "id": "reuses_helper",
      "description": "Reuses app.pagination.paginate rather than re-implementing slicing",
      "command": "python -m pytest -q tests/test_ef_reuse_pagination.py::test_reuses_shared_helper"
    }
  ],
  "timeout_seconds": 480,
  "max_budget_usd": 1.0,
  "graders": {
    "outcome": ["python -m pytest -q tests/test_ef_reuse_pagination.py::test_limit_bounds_results tests/test_ef_reuse_pagination.py::test_offset_skips tests/test_ef_reuse_pagination.py::test_defaults_return_all"],
    "regression": ["python -m pytest -q tests/test_health.py tests/test_tasks_baseline.py"],
    "static": ["ruff check app tests", "mypy app"]
  }
}
