{
  "id": "cli_path_guard",
  "name": "Add path-traversal guard to the --data option of the ledger CLI",
  "suite": "capability",
  "family": "memory_critical",
  "difficulty": "medium",
  "tags": ["concern", "security", "path-traversal", "cli"],
  "prompt": "The ledger CLI already accepts a global --data <file> option. Add a path-traversal guard to it: reject any --data path that resolves outside the current working directory as a user error. Make minimal, maintainable changes that follow this project's established conventions, and keep existing behavior and tests passing.",
  "seed_scenario": "evals/scenarios/cli_ledger_seed",
  "overlays": [],
  "grader_overlays": ["evals/grader_overlays/cli_path_guard"],
  "memory_seed": [
    {
      "type": "concern",
      "title": "Path-traversal guard on --data",
      "summary": "Path-traversal guard: a --data path must resolve to INSIDE the current working directory; a prior version let --data ../../etc/passwd escape. Reject any --data path outside CWD as a user error (exit 2).",
      "confidence": 1.0,
      "status": "confirmed"
    }
  ],
  "warmup": [
    "We discovered a path-traversal vulnerability: the --data option previously accepted paths like ../../etc/passwd that escaped the working directory. We have decided that the --data path MUST resolve to inside the current working directory; any path that resolves outside CWD must be rejected as a user error (exit code 2, message to stderr). Add this guard to the CLI and document it in a brief comment. Briefly state the security concern and how you addressed it."
  ],
  "requirements": [
    {
      "id": "data_inside_cwd_works",
      "description": "--data with a path inside CWD works (exit 0)",
      "command": "python -m pytest -q tests/test_cli_path_guard.py::test_data_inside_cwd_works"
    },
    {
      "id": "data_outside_cwd_rejected",
      "description": "--data with a path outside CWD is rejected with exit 2 (memory-only knowledge)",
      "command": "python -m pytest -q tests/test_cli_path_guard.py::test_data_outside_cwd_rejected"
    }
  ],
  "timeout_seconds": 300,
  "max_budget_usd": 1.0,
  "graders": {
    "outcome": ["python -m pytest -q tests/test_cli_path_guard.py"],
    "regression": ["python -m pytest -q tests/test_ledger_baseline.py"],
    "static": ["ruff check ledger tests", "mypy ledger"]
  }
}
