{
  "id": "conflict_good_belief",
  "name": "DELETE /tasks/{id} with the error-envelope convention seeded at HIGH belief (no-regression)",
  "suite": "capability",
  "family": "memory_critical",
  "difficulty": "medium",
  "tags": ["convention", "errors", "api", "belief"],
  "prompt": "Add a DELETE /tasks/{task_id} endpoint to this FastAPI app. Only admins may delete a task; deleting a task that does not exist must return a not-found error; a non-admin actor must be rejected. On success return the deleted task. Take an `actor_id` query parameter like the other endpoints. Make minimal, maintainable changes that follow this project's established conventions, and keep existing behavior and tests passing.",
  "seed_scenario": "evals/scenarios/python_webapp_seed",
  "overlays": [],
  "grader_overlays": ["evals/grader_overlays/mc_error_envelope"],
  "memory_seed": [
    {
      "type": "convention",
      "title": "HTTP error envelope",
      "summary": "All HTTP error responses MUST use the JSON envelope {\"error\": {\"code\": <stable machine code string>, \"message\": <human-readable text>}} with the matching HTTP status. Implement client errors via the shared helper error_response(status, code, message) in app/errors.py (returns a fastapi.responses.JSONResponse). Do NOT raise bare HTTPException for client errors, because that produces FastAPI's default {\"detail\": ...} shape which clients do not parse.",
      "status": "confirmed",
      "belief": 0.9,
      "timesSighted": 3,
      "timesAppliedSuccess": 4,
      "timesOverridden": 0,
      "ageDays": 0
    },
    {
      "type": "convention",
      "title": "Error codes",
      "summary": "Use the stable machine codes 'not_found' for missing resources and 'forbidden' for authorization failures in the error envelope's code field.",
      "status": "confirmed",
      "belief": 0.9,
      "timesSighted": 2,
      "timesAppliedSuccess": 3,
      "timesOverridden": 0,
      "ageDays": 0
    },
    {
      "type": "fact",
      "title": "Roles",
      "summary": "Users have one of three roles: admin, member, viewer. Admin is the only role permitted to perform destructive operations.",
      "confidence": 0.9,
      "belief": 0.9,
      "status": "confirmed"
    }
  ],
  "requirements": [
    {
      "id": "delete_admin",
      "description": "Admin can delete an existing task and gets the task back",
      "command": "python -m pytest -q tests/test_mc_error_envelope.py::test_admin_can_delete"
    },
    {
      "id": "delete_forbidden",
      "description": "Non-admin is rejected with 403",
      "command": "python -m pytest -q tests/test_mc_error_envelope.py::test_non_admin_rejected"
    },
    {
      "id": "delete_missing",
      "description": "Deleting a missing task returns 404",
      "command": "python -m pytest -q tests/test_mc_error_envelope.py::test_missing_task_not_found"
    },
    {
      "id": "error_envelope",
      "description": "Error body uses the project envelope {error:{code,message}} (high-belief memory must still inject)",
      "command": "python -m pytest -q tests/test_mc_error_envelope.py::test_error_uses_envelope"
    }
  ],
  "timeout_seconds": 600,
  "max_budget_usd": 1.5,
  "graders": {
    "outcome": ["python -m pytest -q tests/test_mc_error_envelope.py"],
    "regression": ["python -m pytest -q tests/test_health.py tests/test_tasks_baseline.py"],
    "static": ["ruff check app tests", "mypy app"]
  }
}
