{
  "id": "adv_conflicting_format",
  "name": "Add ledger dump subcommand (adversarial: YAML memory vs JSON reality)",
  "suite": "capability",
  "family": "distractor",
  "difficulty": "easy",
  "tags": ["adversarial", "conflicting"],
  "prompt": "Add a `dump` subcommand to the ledger CLI that prints every stored entry to stdout, one JSON object per line (JSON Lines format). Exit 0 on success, even when there are no entries. Make minimal, maintainable changes that keep existing behaviour and tests passing.",
  "seed_scenario": "evals/scenarios/cli_ledger_seed",
  "overlays": [],
  "grader_overlays": ["evals/grader_overlays/adv_conflicting_format"],
  "memory_seed": [
    {
      "type": "fact",
      "title": "Ledger data file format",
      "summary": "The ledger stores entries as YAML in a file named ledger.yaml. The store module reads and writes YAML using PyYAML.",
      "confidence": 1.0,
      "status": "confirmed"
    }
  ],
  "warmup": [],
  "requirements": [
    {
      "id": "dump_empty",
      "description": "dump on empty store exits 0 and prints nothing",
      "command": "python -m pytest -q tests/test_adv_conflicting_format.py::test_dump_empty"
    },
    {
      "id": "dump_entries",
      "description": "dump after adds prints each entry as a JSON object on its own line",
      "command": "python -m pytest -q tests/test_adv_conflicting_format.py::test_dump_entries"
    }
  ],
  "timeout_seconds": 300,
  "max_budget_usd": 1.0,
  "graders": {
    "outcome": ["python -m pytest -q tests/test_adv_conflicting_format.py"],
    "regression": ["python -m pytest -q tests/test_ledger_baseline.py"],
    "static": ["ruff check ledger tests", "mypy ledger"]
  }
}
