{
  "id": "adv_stale_field",
  "name": "Add ledger find subcommand (adversarial: stale field name 'body' vs real 'text')",
  "suite": "capability",
  "family": "distractor",
  "difficulty": "easy",
  "tags": ["adversarial", "stale"],
  "prompt": "Add a `find <substr>` subcommand to the ledger CLI that prints all entries whose text contains the given substring (case-sensitive), one JSON object per line. Exit 0 whether or not any entries match. Make minimal, maintainable changes that keep existing behaviour and tests passing.",
  "seed_scenario": "evals/scenarios/cli_ledger_seed",
  "overlays": [],
  "grader_overlays": ["evals/grader_overlays/adv_stale_field"],
  "memory_seed": [
    {
      "type": "convention",
      "title": "Entry text field name",
      "summary": "Each ledger entry stores its content in a field named 'body'. Use entry['body'] to access the entry text when searching or displaying entries.",
      "confidence": 1.0,
      "status": "confirmed"
    }
  ],
  "warmup": [],
  "requirements": [
    {
      "id": "find_match",
      "description": "find returns entries whose text contains the substring",
      "command": "python -m pytest -q tests/test_adv_stale_field.py::test_find_match"
    },
    {
      "id": "find_no_match",
      "description": "find returns nothing when no entries match",
      "command": "python -m pytest -q tests/test_adv_stale_field.py::test_find_no_match"
    }
  ],
  "timeout_seconds": 300,
  "max_budget_usd": 1.0,
  "graders": {
    "outcome": ["python -m pytest -q tests/test_adv_stale_field.py"],
    "regression": ["python -m pytest -q tests/test_ledger_baseline.py"],
    "static": ["ruff check ledger tests", "mypy ledger"]
  }
}
