{
  "id": "cli_count_guardrail",
  "name": "Add ledger count subcommand (guardrail: self-contained, no memory required)",
  "suite": "capability",
  "family": "guardrail",
  "difficulty": "easy",
  "tags": ["guardrail", "count", "cli"],
  "prompt": "Add a `count` subcommand to the ledger CLI that prints the number of entries as a single JSON object with a `count` key (e.g. `{\"count\": 3}`) to stdout. Exit 0 on success. Make minimal, maintainable changes that keep existing behavior and tests passing.",
  "seed_scenario": "evals/scenarios/cli_ledger_seed",
  "overlays": [],
  "grader_overlays": ["evals/grader_overlays/cli_count_guardrail"],
  "memory_seed": [],
  "warmup": [],
  "requirements": [
    {
      "id": "count_empty",
      "description": "count on empty store exits 0 and prints {\"count\": 0}",
      "command": "python -m pytest -q tests/test_cli_count_guardrail.py::test_count_empty"
    },
    {
      "id": "count_after_adds",
      "description": "count reflects number of entries after adds",
      "command": "python -m pytest -q tests/test_cli_count_guardrail.py::test_count_after_adds"
    }
  ],
  "timeout_seconds": 300,
  "max_budget_usd": 1.0,
  "graders": {
    "outcome": ["python -m pytest -q tests/test_cli_count_guardrail.py"],
    "regression": ["python -m pytest -q tests/test_ledger_baseline.py"],
    "static": ["ruff check ledger tests", "mypy ledger"]
  }
}
