{
  "id": "adv_nearmiss_web",
  "name": "Add ledger version subcommand (adversarial: web envelope memory vs plain CLI reality)",
  "suite": "capability",
  "family": "distractor",
  "difficulty": "easy",
  "tags": ["adversarial", "near_miss"],
  "prompt": "Add a `version` subcommand to the ledger CLI that prints a single JSON line containing one key, `version`, whose value is the package version string from pyproject.toml. Exit 0. Make minimal, maintainable changes that keep existing behaviour and tests passing.",
  "seed_scenario": "evals/scenarios/cli_ledger_seed",
  "overlays": [],
  "grader_overlays": ["evals/grader_overlays/adv_nearmiss_web"],
  "memory_seed": [
    {
      "type": "convention",
      "title": "List/collection output envelope",
      "summary": "All list or collection output commands must wrap results in a JSON envelope: {\"items\": [...], \"count\": <int>}. Never emit a bare object or plain value at the top level of CLI output.",
      "confidence": 1.0,
      "status": "confirmed"
    }
  ],
  "warmup": [],
  "requirements": [
    {
      "id": "version_shape",
      "description": "version prints exactly {\"version\": \"<string>\"} and exits 0",
      "command": "python -m pytest -q tests/test_adv_nearmiss_web.py::test_version_shape"
    }
  ],
  "timeout_seconds": 300,
  "max_budget_usd": 1.0,
  "graders": {
    "outcome": ["python -m pytest -q tests/test_adv_nearmiss_web.py"],
    "regression": ["python -m pytest -q tests/test_ledger_baseline.py"],
    "static": ["ruff check ledger tests", "mypy ledger"]
  }
}
